'0125538009849,ยาและเคมีภัณฑ์ สำหรับสัตว์,การขายส่งอาหารสัตว์,ยังดำเนินกิจการอยู่,8/11/2538,550000000,https://vetagritech.com/,"กรรมการ: นายกอง นนทปัทมะดุลย์, นายปกรณ์ ภานุไพศาล, นางสาวดาวรี สมัครคามัย, นายธวัช กิตติบัญชากุล, นายผ่องพัฒน์ แก้วมังกร, นายวิรัช จันทรัศมี, นายศักดิ์ชัย ชินวัฒนชัย, นายชนินทร์ ชัยธนพัฒน์, นายกรินทร์ นนทปัทมะดุลย์",28/92 หมู่ 4 ถนนแจ้งวัฒนะ ตำบลบางตลาด อำเภอปากเกร็ด จ.นนทบุรี 11120,VET AGRITECH COMPANY LIMITED,บริษัท เวท อะกริเทค จำกัด,False,https://www.dataforthai.com/company/0125538009849/,ดูตำแหน่งงานจาก JOBTHAI,,,,,,,'029183488
'0105559149259,ประกอบกิจการบริการโภชนาการทางอาหารสัตว์,การขายส่งอาหารสัตว์,ยังดำเนินกิจการอยู่,20/9/2559,867700000,www.ridley.com.au,"กรรมการ: นายโรเบิร์ต เดวิด ฮาร์วี, นายควินตัน ลานซ์ ฮิลเดอแบรนด์, นายริชาร์ด ชาร์ลส์ เบ็ทซ์",333 หมู่ที่ 13 ตำบลปากน้ำแหลมสิงห์ อำเภอแหลมสิงห์ จ.จันทบุรี 22130,RIDLEY CORPORATION (THAILAND) COMPANY LIMITED,บริษัท ริดลีย์ คอร์ปอเรชัน (ไทยแลนด์) จำกัด,False,https://www.dataforthai.com/company/0105559149259/,,,,,,,,'039444526
'0205561014364,นำเข้าสินค้า วัตถุดิบอาหารสัตว์ ผลิตอาหารสัตว์ และขายอาหารสัตว์,การขายส่งอาหารสัตว์,ยังดำเนินกิจการอยู่,11/4/2561,1410150000,,กรรมการ: นายแจ โยง ฮง,76/57 หมู่ที่ 10 ตำบลทุ่งสุขลา อำเภอศรีราชา จ.ชลบุรี 20230,JL TRANSPORT (THAILAND) COMPANY LIMITED,บริษัท เจแอล ทรานสปอร์ต (ไทยแลนด์) จำกัด,False,https://www.dataforthai.com/company/0205561014364/,,,,,,,,
'0115561010114,นำเข้าสินค้า วัตถุดิบอาหารสัตว์ ผลิตอาหารสัตว์ และขายอาหารสัตว์,การขายส่งอาหารสัตว์,ยังดำเนินกิจการอยู่,11/4/2561,1410150000,,กรรมการ: นายแจ โยง ฮง,12/1 หมู่ที่ 13 ตำบลบางพลีใหญ่ อำเภอบางพลี จ.สมุทรปราการ 10540,JL HOLDINGS (THAILAND) COMPANY LIMITED,บริษัท เจแอล โฮลดิ้งส์ (ไทยแลนด์) จำกัด,False,https://www.dataforthai.com/company/0115561010114/,,,,,,,,
'0107565000093,ผลิตอาหารทะเลบรรจุภาชนะผนึก อาหารสัตว์และปลาป่น,การผลิตปลาบรรจุกระป๋อง,ยังดำเนินกิจการอยู่,10/3/2565,2125000000,www.asianalliance.co.th,"กรรมการ: นายวิชัย อัศรัสกร, นายสมศักดิ์ อมรรัตนชัยกุล, นายสุริยะ ประสาทบัณฑิตย์, นายเอกราช พรรณสังข์, นายเพ็ชร ประภากิตติกุล, นายสามารถ ชัชวาลจำรัส, นางสาวสุพัฒนา หงิมห่วง, นายอรรถวิชช์ สุวรรณภักดี",55/2 หมู่ที่ 2 ถนนพระราม 2 ตำบลบางกระเจ้า อำเภอเมืองสมุทรสาคร จ.สมุทรสาคร 74000,"ASIAN ALLIANCE INTERNATIONAL CO.,LTD. PUBLIC COMPANY LIMITED",บริษัท เอเชี่ยน อะไลอันซ์ อินเตอร์เนชั่นแนล จำกัด (มหาชน),False,https://www.dataforthai.com/company/0107565000093/,ดูตำแหน่งงานจาก JOBTHAI,,,,AAI,,,'03484557587
'0605543000019,ขายส่งสินค้าเกษตร,การขายส่งวัตถุดิบอื่นๆทางการเกษตรซึ่งมิได้จัดประเภทไว้ในที่อื่น,ยังดำเนินกิจการอยู่,6/1/2543,30000000,,กรรมการ: นายอิทธิ สุเมธโชติเมธา,102/14 หมู่ที่ 11 ตำบลบ้านมะเกลือ อำเภอเมืองนครสวรรค์ จ.นครสวรรค์ 60000,JUNG JAI MONG COOPERATION COMPANY LIMITED,บริษัท จึงใจ้หมง โคออพเพอเรชั่น จำกัด,False,https://www.dataforthai.com/company/0605543000019/,,,,,,,,'056212049
'0535561000174,การขายวัตุดิบอื่นๆทางการเกษตร,การขายส่งวัตถุดิบอื่นๆทางการเกษตรซึ่งมิได้จัดประเภทไว้ในที่อื่น,ยังดำเนินกิจการอยู่,7/3/2561,30000000,,กรรมการ: นางสาวจรินธร อินทรเกษตร,14/7 หมู่ที่ 3 ตำบลผักขวง อำเภอทองแสนขัน จ.อุตรดิตถ์ 53230,DUANGUPPATHAM COMPANY LIMITED,บริษัท ดวงอุปถัมภ์ จำกัด,False,https://www.dataforthai.com/company/0535561000174/,,,,,,,,'0887892444
'0105557040420,จำหน่ายพืชผลทางเกษตร,การขายส่งวัตถุดิบอื่นๆทางการเกษตรซึ่งมิได้จัดประเภทไว้ในที่อื่น,ยังดำเนินกิจการอยู่,18/3/2557,30000000,,"กรรมการ: นายอู๋ ปิง จิง, นางสาวเฉิน เซี่ยวน่า, นางสาวปุณยานุช ภูกาบิล, นางสาวลมุน ดิเรกคุณ",75/90 หมู่ที่ 11 ตำบลคลองหนึ่ง อำเภอคลองหลวง จ.ปทุมธานี,DRAGON GOLD 14 TRADING COMPANY LIMITED,บริษัท มังกรทอง 14 เทรดดิ้ง จำกัด,False,https://www.dataforthai.com/company/0105557040420/,,,,,,,,'021014635
'0105520005868,ทำการค้าสินค้า ข้าว ข้าวโพด ข้าวฟ่าง ข้าวสาลี,การขายส่งวัตถุดิบอื่นๆทางการเกษตรซึ่งมิได้จัดประเภทไว้ในที่อื่น,ยังดำเนินกิจการอยู่,9/5/2520,30000000,,กรรมการ: นายราม ชิลา,597-597/1 ซอยสุขุมวิท 33/1 (ซอยแดงอุดม) ถนนสุขุมวิท แขวงคลองตัน เขตคลองเตย กรุงเทพมหานคร 10110,"SIAM TAPIOCA & PRODUCE CO., LTD.",บริษัท มันสำปะหลังสยามและพืชผล จำกัด,False,https://www.dataforthai.com/company/0105520005868/,,,,,,,,
'0425562000691,การขายส่งวัตถุดิบอื่นๆทางการเกษตรซึ่งมิได้จัดประเภทไวในที่ิือื่น,การขายส่งวัตถุดิบอื่นๆทางการเกษตรซึ่งมิได้จัดประเภทไว้ในที่อื่น,ยังดำเนินกิจการอยู่,19/9/2562,100000000,,กรรมการ: นางสาวกรรณภัทร มหาดไทย,264 หมู่ที่ 9 ตำบลหนองผือ อำเภอท่าลี่ จ.เลย 42140,"RUNGRUETHAI TAPIOCA CO., LTD.",บริษัท รุ่งฤทัย ทาปิโอก้า จำกัด,False,https://www.dataforthai.com/company/0425562000691/,,,,,,,,'095190738
'0105546151951,สินค้าเกษตรกรรมทุกชนิด,การขายส่งวัตถุดิบอื่นๆทางการเกษตรซึ่งมิได้จัดประเภทไว้ในที่อื่น,ยังดำเนินกิจการอยู่,22/12/2546,45000000,https://www.rungruengagrifood.com/,"กรรมการ: นางมยุรี ลี, นายซูเหียน ลี, นางสาวอาภรณ์ มณีหิยา, นางสาวสุธิณี ลี",9/20 หมู่ที่ 11 ตำบลคลองหนึ่ง อำเภอคลองหลวง จ.ปทุมธานี,RUNG RUENG AGRI FOOD COMPANY LIMITED,บริษัท รุ่งเรือง แอกริ ฟู้ด จำกัด,False,https://www.dataforthai.com/company/0105546151951/,,,,,,,,'025293300
'0195562000279,,การขายส่งวัตถุดิบอื่นๆทางการเกษตรซึ่งมิได้จัดประเภทไว้ในที่อื่น,ยังดำเนินกิจการอยู่,25/1/2562,60000000,https://th.ynp-agri.com/,"กรรมการ: นายเทียนชัย อยู่นิรันดร, นางทัตติยา อยู่นิรันดร, นายอุกฤษฎ์ อยู่นิรันดร",23/1 หมู่ที่ 5 ตำบลหนองหมู อำเภอวิหารแดง จ.สระบุรี 18150,YU NIRAN PHUET PHON COMPANY LIMITED,บริษัท อยู่นิรันดร์พืชผล จำกัด,False,https://www.dataforthai.com/company/0195562000279/,,,,,,,,'0955520333
'0515546000215,,การขายส่งวัตถุดิบอื่นๆทางการเกษตรซึ่งมิได้จัดประเภทไว้ในที่อื่น,ยังดำเนินกิจการอยู่,19/6/2546,30000000,,"กรรมการ: นางกาญจนา พงศ์พฤกษทล, นางรดา อดุลตระกูล",260 หมู่ที่ 8 ตำบลนครเจดีย์ อำเภอป่าซาง จ.ลำพูน 51120,R.K. FOOD COMPANY LIMITED,บริษัท อาร์.เค ฟู๊ด จำกัด,False,https://www.dataforthai.com/company/0515546000215/,,,,,,,,'053555016
'0135558006489,ขายส่งวัตถุดิบอื่นๆ ทางการเกษตร,การขายส่งวัตถุดิบอื่นๆทางการเกษตรซึ่งมิได้จัดประเภทไว้ในที่อื่น,ยังดำเนินกิจการอยู่,23/3/2558,30000000,,"กรรมการ: นายสุกิจ หวั่งหลี, นายดนัยธนิต พิศาลบุตร, นายวีรวัฒน์ เลิศวนวัฒนา, นางพวงรัตน์ จิรวุฒิตานันท์, นายณัฐชัย หวั่งหลี, นายเขม หวั่งหลี, นายเพชร หวั่งหลี, นายธำรงรัตน์ พิศาลบุตร, นายโยชิโนบุ มัทสุทานี, นายเรียว มัทสุทานี, นางฮารูโย มัทสุทานี, นายมาซาฮิรา โอเทรา, นายไดชิ นากาโน",38/6 หมู่ที่ 11 ถนนปทุมธานี-ลาดหลุมแก้ว ตำบลคูบางหลวง อำเภอลาดหลุมแก้ว จ.ปทุมธานี 12140,SMS CORPORATION COMPANY LIMITED,บริษัท เอสเอ็มเอส คอร์ปอเรชั่น จำกัด,False,https://www.dataforthai.com/company/0135558006489/,,,,,,,,'025981128
'0525523000022,จำหน่ายครั่ง,การขายส่งวัตถุดิบอื่นๆทางการเกษตรซึ่งมิได้จัดประเภทไว้ในที่อื่น,ยังดำเนินกิจการอยู่,18/3/2523,30000000,,"กรรมการ: นายเสริมศักดิ์ พันธุมสินชัย, นางวนิดา พันธุมสินชัย, นายภาณุ พันธุมสินชัย, นางสาวญานันต์ พันธุมสินชัย, นางอุทัย ตันละมัย",220 ถนนพหลโยธิน หมู่ 10 ตำบลชมพู อำเภอเมืองลำปาง จ.ลำปาง 52100,THAI SHELLAC (1980) COMPANY LIMITED,บริษัท ไทยแชลแลค (1980) จำกัด,False,https://www.dataforthai.com/company/0525523000022/,,,,,,,,'054251045
'0645547000102,การขายส่งวัตถุดิบเกษตรอื่นๆ ที่มิได้ระบุไว้ที่อื่น,การขายส่งวัตถุดิบอื่นๆทางการเกษตรซึ่งมิได้จัดประเภทไว้ในที่อื่น,ยังดำเนินกิจการอยู่,29/6/2547,32000000,http://www.malaigreen.com/,กรรมการ: นายสุพรรณ มาลัย,39/181-182 ซอยพิพรพงษ์ 2 หมู่ที่ 9 ถนนวิภาวดีรังสิต แขวงสีกัน เขตดอนเมือง กรุงเทพมหานคร 10210,MALAI AGRICULTURE FOOD COMPANY LIMITED,บริษัท มาลัยพืชผล จำกัด,False,https://www.dataforthai.com/company/0645547000102/,,,,,,,,'025329173
'0105553042304,ค้าขายพืชผลทางการเกษตรและเศษวัสดุเหลือใช้ที่ก่อให้เกิดพลังงานผลิตพลังงานไฟฟ้าจากแหล่งธรรมชาติหรือแหล่งอื่นใดโดยใช้เทคโนโลยี,การขายส่งวัตถุดิบอื่นๆทางการเกษตรซึ่งมิได้จัดประเภทไว้ในที่อื่น,ยังดำเนินกิจการอยู่,25/3/2553,68000000,,"กรรมการ: นายจีระ หล่อวัฒนกิจชัย, นางสาวกรวรา อัศวลาภนิรันดร, นายดรงค์ฤทธิ์ อัศวลาภนิรันดร, นางนฤมล อัศวลาภนิรันดร",133 ซอยเพิ่มสิน แขวงดินแดง เขตดินแดง กรุงเทพมหานคร 10400,SOLNERGY COMPANY LIMITED,บริษัท โซลเนอร์จี จำกัด,False,https://www.dataforthai.com/company/0105553042304/,,,,,,,,
'0645561000564,,การขายส่งวัตถุดิบอื่นๆทางการเกษตรซึ่งมิได้จัดประเภทไว้ในที่อื่น,ยังดำเนินกิจการอยู่,12/12/2561,35000000,,กรรมการ: นายเรืองชัย พรวุฒิพันธุ์,38 หมู่ที่ 10 ตำบลปากน้ำ อำเภอสวรรคโลก จ.สุโขทัย 64110,KOONSUB WANICH COMPANY LIMITED,บริษัท คูณทรัพย์วาณิช จำกัด,False,https://www.dataforthai.com/company/0645561000564/,,,,,,,,
'0105557094619,นำเข้าพืชผลทางการเกษตรทุกชนิด,การขายส่งวัตถุดิบอื่นๆทางการเกษตรซึ่งมิได้จัดประเภทไว้ในที่อื่น,ยังดำเนินกิจการอยู่,3/7/2557,35000000,,"กรรมการ: นายฟาง เจินหนัน, นายประเทืองรัตน์ พงษ์จตุรา",16/24 ซอยเทียนทะเล 20 ถนนบางขุนเทียน-ชายทะเล แขวงแสมดำ เขตบางขุนเทียน กรุงเทพมหานคร 10150,NAN SING COMPANY LIMITED,บริษัท หนานซิ้ง จำกัด,False,https://www.dataforthai.com/company/0105557094619/,,,,,,,,
'0505561011281,ประกอบกิจการรับซื้อ จำหน่ายและส่งออกผลผลิตทางการเกษตรและสินค้าแปรรูปทางการเกษตรทุกชนิด,การขายส่งวัตถุดิบอื่นๆทางการเกษตรซึ่งมิได้จัดประเภทไว้ในที่อื่น,ยังดำเนินกิจการอยู่,10/7/2561,35000000,,"กรรมการ: นางสาวจำปา ไชยมงคล, นางสาวรัชนีกร แซ่ต้วน, นายจาง ชีเหวิน",128/1 หมู่ที่ 7 ตำบลเหมืองแก้ว อำเภอแม่ริม จ.เชียงใหม่ 50180,THAI AGRICULTURE MACHINERY TECHNOLOGY COMPANY LIMITED,บริษัท เทคโนโลยีเครื่องจักรเกษตรไทย จำกัด,False,https://www.dataforthai.com/company/0505561011281/,,,,,,,,'053120588
'0105558179120,ประกอบกิจการค้าส่งน้ำมันปาล์ม รวมทั้งผลผลิตทั้งหลายที่เกี่ยวข้องกับน้ำมันปาล์ม,การขายส่งวัตถุดิบอื่นๆทางการเกษตรซึ่งมิได้จัดประเภทไว้ในที่อื่น,ยังดำเนินกิจการอยู่,10/11/2558,40000000,,กรรมการ: นายเณริน จันทกร,429/23 ถนนลาดพร้าววังหิน แขวงลาดพร้าว เขตลาดพร้าว กรุงเทพมหานคร 10230,GI GREEN PALM OIL COMPANY LIMITED,บริษัท จีไอ กรีน ปาล์ม ออยล์ จำกัด,False,https://www.dataforthai.com/company/0105558179120/,ดูตำแหน่งงานจาก JOBTHAI,,,,,,,
'0305561002195,ประกอบกิจการนำเข้ามาจำหน่ายและส่งออกไปยังต่างประเทศ มันสำปะหลัง มันสำปะหลังแปรรูปทุกชนิด แป้ง แป้งมัน มันตากแห้ง มันเส้น กากมัน,การขายส่งวัตถุดิบอื่นๆทางการเกษตรซึ่งมิได้จัดประเภทไว้ในที่อื่น,ยังดำเนินกิจการอยู่,10/4/2561,40000000,,"กรรมการ: นายกิตติ เชาวน์ดี, นางสาวเลอสิริ อัศวเมธา",392 หมู่ที่ 6 ตำบลหนองสรวง อำเภอขามทะเลสอ จ.นครราชสีมา 30280,SUPANNEE EXPORT COMPANY LIMITED,บริษัท สุพรรณี เอ็กซ์พอร์ต จำกัด,False,https://www.dataforthai.com/company/0305561002195/,,,,,,,,
'0105553105501,ขายส่งวัตถุดิบอื่นๆ ทางการเกษตรซิ่งมิได้จัดประเภทไว้ในที่อื่น,การขายส่งวัตถุดิบอื่นๆทางการเกษตรซึ่งมิได้จัดประเภทไว้ในที่อื่น,ยังดำเนินกิจการอยู่,30/8/2553,40000000,,"กรรมการ: นายสมยศ จำปี, นายประวิณ จำปี, นายธำรงค์เดช อินทนิเวศน์, นายรุ่งโรจน์ จำปี",583-589 ถนนจักรเพชร แขวงวังบูรพาภิรมย์ เขตพระนคร กรุงเทพมหานคร 10200,"AMARDASS INTERTRADE CO.,LTD.",บริษัท อำมาด๊าส อินเตอร์เทรด จำกัด,False,https://www.dataforthai.com/company/0105553105501/,,,,,,,,'026239505
'0105537028246,ปลูกและจำหน่ายพืชผลทางการเกษตร,การขายส่งวัตถุดิบอื่นๆทางการเกษตรซึ่งมิได้จัดประเภทไว้ในที่อื่น,ยังดำเนินกิจการอยู่,8/3/2537,40000000,,"กรรมการ: นายพิเศษ เอี่ยมสกุลรัตน์, นางจินตนา อัสดรนิธี, นายกระวี เอี่ยมสกุลรัตน์, นางอำพัน เอี่ยมสกุลรัตน์, นายสมสิทธิ์ อัสดรนิธี, นายโสรัชย์ อัสดรนิธี, นายวรวัธน์ อัสดรนิธี",22 สุขุมวิท 35 (ซอยเจริญนิเวศน์) ถนนสุขุมวิท แขวงคลองตันเหนือ เขตวัฒนา กรุงเทพมหานคร 10110,K-AGRO,บริษัท เค การเกษตร จำกัด,False,https://www.dataforthai.com/company/0105537028246/,,,,,,,,
'0675561001072,การขายส่งวัตถุดิบอื่นๆ ทางการเกษตรซึ่งมิได้จัดประเภทไว้ในที่อื่น,การขายส่งวัตถุดิบอื่นๆทางการเกษตรซึ่งมิได้จัดประเภทไว้ในที่อื่น,ยังดำเนินกิจการอยู่,16/8/2561,40000000,,กรรมการ: นายจิรภัทร สิริบุญญาภัทร,9 หมู่ที่ 9 ตำบลช้างตะลูด อำเภอหล่มสัก จ.เพชรบูรณ์ 67110,AP INTERRICE AND TRADING COMPANY LIMITED,บริษัท เอ พี อินเตอร์ไรซ์ แอนด์ เทรดดิ้ง จำกัด,False,https://www.dataforthai.com/company/0675561001072/,,,,,,,,
'0105551107085,ค้าส่งน้ำมันปาล์มรวมทั้งผลผลิตทั้งหลายที่เกี่ยวข้องกับน้ำมันปาล์ม,การขายส่งผลิตภัณฑ์ขนมอบไข่น้ำมันและไขมันที่ใช้ในการบริโภค,ยังดำเนินกิจการอยู่,19/9/2551,40000000,,กรรมการ: นายเณริน จันทกร,8/2 ถนนสุคนธสวัสดิ์ แขวงลาดพร้าว เขตลาดพร้าว กรุงเทพมหานคร 10230,"GLOBAL PALM OIL CO.,LTD.",บริษัท โกลบอล ปาล์ม ออยล์ จำกัด,False,https://www.dataforthai.com/company/0105551107085/,,,,,,,,'0290769923
