'0165548000518,จำหน่ายมันสำปะหลังและข้าวโพด,การขายส่งข้าวเปลือกและธัญพืชอื่นๆ,ยังดำเนินกิจการอยู่,21/10/2548,40000000,,,108 หมู่ที่ 8 ตำบลท่ามะนาว อำเภอชัยบาดาล จ.ลพบุรี 15130,P.S.H. EXPORT IMPORT COMPANY LIMITED,บริษัท พี.เอส.เอช. เอ็กสปอร์ต อิมปอร์ต จำกัด,False,https://www.dataforthai.com/company/0165548000518/,,,,,,,,
'0125538006491,ส่งออกสินค้าเกษตร,การขายส่งข้าวเปลือกและธัญพืชอื่นๆ,ยังดำเนินกิจการอยู่,26/7/2538,40000000,http://www.semfruits.com,,101/1 หมู่ที่ 2 ตำบลไทรม้า อำเภอเมืองนนทบุรี จ.นนทบุรี 11000,"SIAM EXPORT MART CO., LTD.",บริษัท สยาม เอ็กซ์ปอร์ต มาร์ท จำกัด,False,https://www.dataforthai.com/company/0125538006491/,ดูตำแหน่งงานจาก JOBTOPGUN,,,,,,,
'0105534079141,การขายต่างประเทศ,การขายส่งข้าวเปลือกและธัญพืชอื่นๆ,ยังดำเนินกิจการอยู่,22/8/2534,40000000,,,1023 อาคารเอ็ม เอส สยามทาวเวอร์ ชั้น 36 ถนนพระราม 3 แขวงช่องนนทรี เขตยานนาวา กรุงเทพมหานคร 10120,"NCA. ENTERPRISE CO., LTD.",บริษัท เอ็นซีเอ.เอ็นเตอร์ไพร้ส จำกัด,False,https://www.dataforthai.com/company/0105534079141/,,,,,,,,
'0575538001224,จำหน่ายพืชผลทางการเกษตร,การขายส่งข้าวเปลือกและธัญพืชอื่นๆ,ยังดำเนินกิจการอยู่,25/12/2538,42400000,,,201 หมู่ที่ 2 ตำบลปล้อง อำเภอเทิง จ.เชียงราย 57230,,บริษัท เชียงรายกิจศิริไซโล 1995 จำกัด,False,https://www.dataforthai.com/company/0575538001224/,,,,,,,,'053954195
'0195527000110,จำหน่ายพืชไร่,การขายส่งข้าวเปลือกและธัญพืชอื่นๆ,ยังดำเนินกิจการอยู่,21/8/2527,30000000,,,14 หมู่ที่ 9 ตำบลขุนโขลน อำเภอพระพุทธบาท จ.สระบุรี 18120,,บริษัท ทรัพย์พูนผลอุตสาหกรรมไซโล จำกัด,False,https://www.dataforthai.com/company/0195527000110/,,,,,,,,'036266173
'0105546040385,จำหน่ายผลิตภัณฑ์ทางการเกษตร,การขายส่งข้าวเปลือกและธัญพืชอื่นๆ,ยังดำเนินกิจการอยู่,31/3/2546,45000000,,,328 หมู่ที่ 2 ถนนเชียงใหม่-พร้าว ตำบลแม่แฝก อำเภอสันทราย จ.เชียงใหม่ 50290,UNION FRESH (2003) COMPANY LIMITED,บริษัท ยูเนี่ยน เฟรช (2003) จำกัด,False,https://www.dataforthai.com/company/0105546040385/,,,,,,,,'052000394
'0205548017631,ส่งออกมันสำปะหลัง,การขายส่งข้าวเปลือกและธัญพืชอื่นๆ,ยังดำเนินกิจการอยู่,29/6/2548,45000000,,,25/3 หมู่ที่ 3 ถนนเศรษฐกิจ ตำบลหนองรี อำเภอเมืองชลบุรี จ.ชลบุรี 20000,SORNANAN THAI TAPIOCA COMPANY LIMITED,บริษัท ศรอนันต์ ไทย ทาปิโอก้า จำกัด,False,https://www.dataforthai.com/company/0205548017631/,,,,,,,,'038476436
'0125556016517,กิจการค้าข้าว ข้าวโพด มันสำปะหลัง ปาล์มน้ำมัน ผลิตภัณฑ์จากสินค้าดังกล่าว,การขายส่งข้าวเปลือกและธัญพืชอื่นๆ,ยังดำเนินกิจการอยู่,12/7/2556,50000000,,,370 หมู่ที่ 2 ตำบลศรีเทพ อำเภอศรีเทพ จ.เพชรบูรณ์ 67170,PHIRUNPHAT COMPANY LIMITED,บริษัท พิรุณพัฒน์ จำกัด,False,https://www.dataforthai.com/company/0125556016517/,,,,,,,,
'0505541001213,จำหน่ายพืชผลเกษตร,การขายส่งข้าวเปลือกและธัญพืชอื่นๆ,ยังดำเนินกิจการอยู่,15/6/2541,50000000,,,98 หมู่ที่ 17 ตำบลแม่สูน อำเภอฝาง จ.เชียงใหม่ 50110,THANATHON CITRUS ORCHAAD COMPANY LIMITED,บริษัท สวนส้มธนาธร จำกัด,False,https://www.dataforthai.com/company/0505541001213/,ดูตำแหน่งงานจาก JOBTOPGUN,,,,,,,'0899989889
'0625550000118,ค้าพืชไร่,การขายส่งข้าวเปลือกและธัญพืชอื่นๆ,ยังดำเนินกิจการอยู่,11/10/2550,50000000,,,88 หมู่ที่ 8 ตำบลทรงธรรม อำเภอเมืองกำแพงเพชร จ.กำแพงเพชร 62000,KPS COMPANY LIMITED,บริษัท เค.พี.เอส จำกัด,False,https://www.dataforthai.com/company/0625550000118/,,,,,,,,'0817276171
'0643547000224,ซื้อ ขายผลผลิตทางการเกษตรและเครื่องมือการเกษตร,การขายส่งข้าวเปลือกและธัญพืชอื่นๆ,ยังดำเนินกิจการอยู่,19/5/2547,50000000,,,51 หมู่ที่ 1 ถนนจรดวิถีถ่อง ตำบลลานหอย อำเภอบ้านด่านลานหอย จ.สุโขทัย 64140,THAIDUMRONG AGO LIMITED PARTNERSHIP,ห้างหุ้นส่วนจำกัด ไทยดำรงค์ อะโกร,False,https://www.dataforthai.com/company/0643547000224/,,,,,,,,
'0105558176791,ประกอบกิจการเลี้ยงโคนมและโคเนื้อ และผลิตภัณฑ์จากนมวัว,การเลี้ยงโคนมและโคเนื้อ,ยังดำเนินกิจการอยู่,4/11/2558,60000000,,,45 ซอยปรียานุช (พระราม 9 ซอย 19) ถนนพระราม 9 แขวงบางกะปิ เขตห้วยขวาง กรุงเทพมหานคร 10310,NIPPON FARM (THAILAND) COMPANY LIMITED,บริษัท นิปปอน ฟาร์ม (ไทยแลนด์) จำกัด,False,https://www.dataforthai.com/company/0105558176791/,,,,,,,,
'0475560001186,,การขายส่งข้าวเปลือกและธัญพืชอื่นๆ,ยังดำเนินกิจการอยู่,28/12/2560,54000000,,,375/21 ถนนเลี่ยงเมือง ตำบลธาตุเชิงชุม อำเภอเมืองสกลนคร จ.สกลนคร 47000,A.RUAMCHAI SAKONNAKHON 2017 COMPANY LIMITED,บริษัท อ.รวมชัย สกลนคร 2017 จำกัด,False,https://www.dataforthai.com/company/0475560001186/,,สมาชิก dataforthai.com สามารถดูข้อมูลการติดต่อเพิ่มเติมได้  สมัครสมาชิกฟรี,,,,,,'042711622
'0105532057370,ซื้อมาขายไปพืชผลเกษตร,การขายส่งข้าวเปลือกและธัญพืชอื่นๆ,ยังดำเนินกิจการอยู่,23/6/2532,55000000,,,93/9 หมู่ที่ 1 ถนนพระราม 2 ตำบลบางน้ำจืด อำเภอเมืองสมุทรสาคร จ.สมุทรสาคร 74000,"BANGKOK YODSIN CO., LTD.",บริษัท บางกอกยอดสิน จำกัด,False,https://www.dataforthai.com/company/0105532057370/,,,,,,,,
'0105551058491,,การขายส่งผักและผลไม้,ยังดำเนินกิจการอยู่,3/6/2551,60000000,,,97 ถนนเย็นจิต แขวงทุ่งวัดดอน เขตสาทร กรุงเทพมหานคร 10120,C.P. STARLANES COMPANY LIMITED,บริษัท ซี.พี. สตาร์เลนส์ จำกัด,False,https://www.dataforthai.com/company/0105551058491/,,สมาชิก dataforthai.com สามารถดูข้อมูลการติดต่อเพิ่มเติมได้  สมัครสมาชิกฟรี,,,,,,'026759664
'0465556000472,ขายส่ง,การขายส่งเครื่องจักรอุปกรณ์และเครื่องใช้ทางการเกษตร,ยังดำเนินกิจการอยู่,28/10/2556,60000000,,,333 หมู่ที่ 2 ตำบลคลองขาม อำเภอยางตลาด จ.กาฬสินธุ์ 46120,THAI THUN YA CHAROEN COMPANY LIMITED,บริษัท ไทยธัญญเจริญ จำกัด,False,https://www.dataforthai.com/company/0465556000472/,,,,,,,,'043840236
'0105534043805,ขายพืชผลทางการเกษตร,การขายส่งข้าวเปลือกและธัญพืชอื่นๆ,ยังดำเนินกิจการอยู่,9/5/2534,61000000,,,15-17 ซอยจันทน์ 16 แขวงทุ่งวัดดอน เขตสาทร กรุงเทพมหานคร 10120,HIGHLAND RESORT COMPANY LIMITED,บริษัท ไฮแลนด์รีสอร์ท จำกัด,False,https://www.dataforthai.com/company/0105534043805/,,,,,,,,
'0105551047180,ประกอบกิจการส่งออกผลิตภัณฑ์มันสำปะหลัง,การขายส่งข้าวเปลือกและธัญพืชอื่นๆ,ยังดำเนินกิจการอยู่,29/4/2551,62500000,,,542/65 ซอยประชาราษฎร์บำเพ็ญ 24 แยก 4-7 ถนนประชาราษฎร์บำเพ็ญ แขวงสามเสนนอก เขตห้วยขวาง กรุงเทพมหานคร 10310,"K TAPIOCA TRASING CO.,LTD.",บริษัท เค ทาปิโอก้า เทรดดิ้ง จำกัด,False,https://www.dataforthai.com/company/0105551047180/,,,,,,,,
'0105537116048,ธุรกิจขายส่ง-ปลีกข้าวสารบรรจุถุง,การขายส่งข้าวและผลิตภัณฑ์ที่ได้จากการโรงสีข้าว,ยังดำเนินกิจการอยู่,29/9/2537,68110000,www.hongthongrice.com,,345 ถนนเลี่ยงเมืองนนทบุรี ตำบลบางกระสอ อำเภอเมืองนนทบุรี จ.นนทบุรี 11000,CHIA MENG MARKETING COMPANY LIMITED,บริษัท เจียเม้ง มาร์เก็ตติ้ง จำกัด,False,https://www.dataforthai.com/company/0105537116048/,,สมาชิก dataforthai.com สามารถดูข้อมูลการติดต่อเพิ่มเติมได้  สมัครสมาชิกฟรี,,,,,,'025267771
'0105551083151,จำหน่ายพืชผลทางการเกษตร,การขายส่งข้าวเปลือกและธัญพืชอื่นๆ,ยังดำเนินกิจการอยู่,29/7/2551,70000000,,,75/93 หมู่ที่ 11 ตำบลคลองหนึ่ง อำเภอคลองหลวง จ.ปทุมธานี,"KIMPAISAL AGRICULTURE CO.,LTD.",บริษัท คิมไพศาล การเกษตร จำกัด,False,https://www.dataforthai.com/company/0105551083151/,,,,,,,,
'0905542001655,สินค้าการเกษตร,การขายส่งข้าวเปลือกและธัญพืชอื่นๆ,ยังดำเนินกิจการอยู่,9/12/2542,70000000,https://silicontechs.co.th/,,"200/10, 200/11, 200/12 หมู่ที่ 5 ตำบลท่าช้าง อำเภอบางกล่ำ จ.สงขลา 90110","SILICON TECHS CO., LTD.",บริษัท ซิลิคอน เทคส์ จำกัด,False,https://www.dataforthai.com/company/0905542001655/,ดูตำแหน่งงานจาก JOBTOPGUN,สมาชิก dataforthai.com สามารถดูข้อมูลการติดต่อเพิ่มเติมได้  สมัครสมาชิกฟรี,,,,,,'07435772730
'0105549099275,ส่งออกผลิตภัณฑ์มันสำปะหลัง,การขายส่งข้าวเปลือกและธัญพืชอื่นๆ,ยังดำเนินกิจการอยู่,17/8/2549,75000000,,,466/31 อาคารจี พี เฮ้าส์ สาทร ชั้น4 ซอยสวนพลู แขวงทุ่งมหาเมฆ เขตสาทร กรุงเทพมหานคร 10120,PN TAPIOCA COMPANY LIMITED,บริษัท พีเอ็น ทาปิโอก้า จำกัด,False,https://www.dataforthai.com/company/0105549099275/,,,,,,,,'026794834
'0275554000019,จำหน่ายพืชผลทางการเกษตร,การขายส่งข้าวเปลือกและธัญพืชอื่นๆ,ยังดำเนินกิจการอยู่,12/1/2554,78000000,http://www.kosongroup.com,,อาคารสำนักงานที่ 2 เอสวี ซิตี้ เลขที่ 898/16 ชั้นที่ 10 ถนนพระราม 3 แขวงบางโพงพาง เขตยานนาวา กรุงเทพมหานคร 10120,KS AGRO COMPANY LIMITED,บริษัท เคเอส อะโกร จำกัด,False,https://www.dataforthai.com/company/0275554000019/,,,,,,,,'0819280527
'0105536080813,ซื้อขายพืชผลทางเกษตร,การขายส่งข้าวเปลือกและธัญพืชอื่นๆ,ยังดำเนินกิจการอยู่,15/7/2536,80000000,,"กรรมการ: นายพรเทพ เจริญเกียรติกุล, นายวรวิทย์ เจนธนากุล",1 อาคารฟอร์จูนเฮ้าส์ ถนนรัชดาภิเษก แขวงดินแดง เขตดินแดง กรุงเทพมหานคร 10400,PETROASIA INTERNATIONAL CORPORATION LIMITED,บริษัท ปิโตรเอเซีย อินเตอร์เนชั่นแนล คอร์ปอเรชั่น จำกัด,False,https://www.dataforthai.com/company/0105536080813/,,,,,,,,'02641160910
'0205560012775,ให้เช่าอสังหาริมทรัพย์,บริการเกี่ยวกับสิทธิพิเศษอื่น ๆ,ยังดำเนินกิจการอยู่,19/4/2560,80000000,,"กรรมการ: นางสาวณัฐพัชญ์ เนื่องจำนงค์, นางสาวณัฐธยาน์ เนื่องจำนงค์, นางสาวนพรรษ์สร เนื่องจำนงค์",196/15 หมู่ที่ 1 ตำบลคลองกิ่ว อำเภอบ้านบึง จ.ชลบุรี 20220,NUEANGJAMNONG INTERTRADE COMPANY LIMITED,บริษัท เนื่องจำนงค์ อินเตอร์เทรด จำกัด,False,https://www.dataforthai.com/company/0205560012775/,,,,,,,,
'0345547000121,,การขายส่งข้าวเปลือกและธัญพืชอื่นๆ,ยังดำเนินกิจการอยู่,19/2/2547,82000000,,"กรรมการ: นายนิธิ จำปาทอง, นายอำนาจ จำปาทอง",100 หมู่ที่ 5 ตำบลหนองไข่นก อำเภอม่วงสามสิบ จ.อุบลราชธานี 34140,E'SARNTAI KAKAOW COMPANY LIMITED,บริษัท อิสาณใต้ค้าข้าว จำกัด,False,https://www.dataforthai.com/company/0345547000121/,,,,,,,,'045385063
'0105517002128,ผลผลิตการเกษตร,การขายส่งข้าวเปลือกและธัญพืชอื่นๆ,ยังดำเนินกิจการอยู่,18/2/2517,85000000,,"กรรมการ: นางสาวิตรี รมยะรูป, นางสุชาดา ลีสวัสดิ์ตระกูล, นายสุเทพ ทองจันทร์, นายสาธร ฉันท์เรืองวณิชย์",49 อาคารเอเซียเสริมกิจ ซอยพิพัฒน์ (สีลม 3) ถนนสีลม แขวงสีลม เขตบางรัก กรุงเทพมหานคร 10500,"AMORNPHAN NAKORN CO., LTD.",บริษัท อมรพันธุ์นคร จำกัด,False,https://www.dataforthai.com/company/0105517002128/,,,,,,,,
'0105543089243,จำหน่ายสินค้าเพื่อการเกษตร,การขายส่งข้าวเปลือกและธัญพืชอื่นๆ,ยังดำเนินกิจการอยู่,21/9/2543,90000000,http://ninee.co.th/,"กรรมการ: นางวรารัตน์ วีรยวรางกูร, นางสาวดรุณี จันทรวงศ์, นายนิพนธ์ ไพณุจิตร",161 ถนนประชาอุทิศ แขวงดอนเมือง เขตดอนเมือง กรุงเทพมหานคร 10210,NINEE COMPANY LIMITED,บริษัท นิณี จำกัด,False,https://www.dataforthai.com/company/0105543089243/,ดูตำแหน่งงานจาก JOBTH,,,,,,,'029282036
'0145546000987,จำหน่ายพืชผลทางการเกษตร,การขายส่งข้าวเปลือกและธัญพืชอื่นๆ,ยังดำเนินกิจการอยู่,29/5/2546,90000000,https://www.kosongroup.com/HOME/,กรรมการ: นายภากร โฆสนสิทธิวิทย์,128 หมู่ที่ 7 ตำบลสนับทึบ อำเภอวังน้อย จ.พระนครศรีอยุธยา 13170,KOSON COMPANY LIMITED,บริษัท โฆสน จำกัด,False,https://www.dataforthai.com/company/0145546000987/,,,,,,,,'0819280527
'0505562002294,ประกอบกิจการโรงสีข้าว การขายปลีก-ขายส่ง ข้าวสารและผลิตภัณฑ์ที่ได้จากโรงสีข้าว,การสีข้าว,ยังดำเนินกิจการอยู่,6/2/2562,100000000,,กรรมการ: นางสาวนงลักษณ์ นาใจ,123 หมู่ที่ 7 ตำบลแม่สาว อำเภอแม่อาย จ.เชียงใหม่ 50280,DUANGDEE RICE COMPANY LIMITED,บริษัท ดวงดีไรซ์ จำกัด,False,https://www.dataforthai.com/company/0505562002294/,,,,,,,,'0954496962
'0635557000679,ประกอบกิจการขายพืชไร่,การขายส่งข้าวเปลือกและธัญพืชอื่นๆ,ยังดำเนินกิจการอยู่,27/10/2557,100000000,,กรรมการ: นายเริงชัย สุวรรณ์,133 หมู่ที่ 9 ตำบลแม่ปะ อำเภอแม่สอด จ.ตาก 63110,"PUECHPHOL SUWANNAPOOM CO.,LTD.",บริษัท พืชผลสุวรรณภูมิ จำกัด,False,https://www.dataforthai.com/company/0635557000679/,,,,,,,,'055532489
'0275550000120,รับเหมาค่าแรง ค่าจ้าง,กิจกรรมการก่อสร้างเฉพาะด้านอื่นๆซึ่งมิได้จัดประเภทไว้ในที่อื่น,ยังดำเนินกิจการอยู่,11/7/2550,100000000,,กรรมการ: นางสาวรัชนี วีระกุล,261/2-3 หมู่ที่ 1 ตำบลวังน้ำเย็น อำเภอวังน้ำเย็น จ.สระแก้ว 27210,"YINGWATTANA TAPIOCA CO.,LTD.",บริษัท ยิ่งวัฒนา ทาปิโอก้า จำกัด,False,https://www.dataforthai.com/company/0275550000120/,,,,,,,,'037251281
'0105546054459,ส่งออกพืชผลทางการเกษตร,การขายส่งข้าวเปลือกและธัญพืชอื่นๆ,ยังดำเนินกิจการอยู่,12/5/2546,110000000,,"กรรมการ: นายการุณ ตันติพงศ์อนันต์, นายธนภณ ตันติพงศ์อนันต์, นายชาญชัย ตันติพงศ์อนันต์, นายไพศาล ตันติพงศ์อนันต์",39/9 หมู่ที่ 1 ตำบลพระยาบันลือ อำเภอลาดบัวหลวง จ.พระนครศรีอยุธยา 13230,"NANAPAN AGRI-INDUSTRIAL CO.,LTD.",บริษัท นานาพรรณเกษตรอุตสาหกรรม จำกัด,False,https://www.dataforthai.com/company/0105546054459/,ดูตำแหน่งงานจาก JOBTOPGUN,,,,,,,'02221811620
'0125544009464,การขายส่งข้าวเปลือกและธัญพืชอื่น ๆ,การขายส่งข้าวเปลือกและธัญพืชอื่นๆ,ยังดำเนินกิจการอยู่,7/11/2544,135000000,http://www.raitip.com/index.php,"กรรมการ: นายสมคิด เลิศสกุลเจริญ, นายสมหวัง เลิศสกุลเจริญ","62/3, 62/5 หมู่ที่ 3 ตำบลบางใหญ่ อำเภอบางใหญ่ จ.นนทบุรี 11140",,บริษัท ไร่ธัญญะ จำกัด,False,https://www.dataforthai.com/company/0125544009464/,ดูตำแหน่งงานจาก JOBBKK,,,,,,,'024187111
'0423554003031,ประกอบกิจการ รับซื้อและจำหน่ายพืชไร่,การขายส่งข้าวเปลือกและธัญพืชอื่นๆ,ยังดำเนินกิจการอยู่,24/8/2554,137821600,,"หุ้นส่วน: นางสาวกรรณภัทร มหาดไทย
       ลงหุ้นด้วยเงิน จำนวน 137,321,600.00 บาท, นางสาวกมลวรรณ มหาดไทย
       ลงหุ้นด้วยเงิน จำนวน 500,000.00 บาท",224 หมู่ที่ 9 ตำบลหนองผือ อำเภอท่าลี่ จ.เลย 42140,"LANMAN RUNGRUETHAIPANIT LTD.,PART.",ห้างหุ้นส่วนจำกัด ลานมัน รุ่งฤทัยพาณิชย์,False,https://www.dataforthai.com/company/0423554003031/,,,,,,,,'042815668
