เลขทะเบียน,ประกอบธุรกิจ,หมวดธุรกิจ,สถานะ,วันที่จดทะเบียน,ทุนจดทะเบียน,Website,ก่อตั้งโดย,ที่ตั้ง,ชื่อบริษัทภาษาอังกฤษ,ชื่อบริษัทภาษาไทย,ข้อมูลสำหรับการติดต่อ,ที่มา,สมัครงาน / ดูตำแหน่งงานว่าง,ข้อมูลสำหรับติดต่อ,วันที่เลิก,เสร็จชำระบัญชี,หลักทรัพย์,วันที่ร้าง,ศาลสั่งพิทักษ์ทรัพย์,เบอร์โทร
'0735559001809,ประกอบกิจการนำเข้า เพื่อขายส่ง ขายปลีก เห็ดหอม เห็ดหูหนูขาว เห็ดหูหนูดำ เยื่อไผ่ และสินค้าอุปโภคบริโภค,การขายส่งวัตถุดิบทางการเกษตรและสัตว์มีชีวิตโดยได้รับค่าตอบแทนหรือตามสัญญาจ้าง,ยังดำเนินกิจการอยู่,21/3/2559,30000000,https://www.wantai2016.com,"กรรมการ: นางสาวสุจิตรา ทารส, นายหมิ่นเจี๋ย หลี่",80/19 หมู่ที่ 1 ตำบลบ้านเกาะ อำเภอเมืองสมุทรสาคร จ.สมุทรสาคร 74000,WANTAI INTERNATIONAL TRADING COMPANY LIMITED,บริษัท ว่านไท่ อินเตอร์เนชั่นแนล เทรดดิ้ง จำกัด,False,https://www.dataforthai.com/company/0735559001809/,,,,,,,,'0918830099
'0105558103051,ประกอบธุรกิจนำเข้า-ส่งออก สินค้าเกษตร,กิจกรรมของตัวแทนผู้รับจัดการขนส่งสินค้าและตัวแทนออกของ (ตัวแทนดำเนินพิธีการศุลกากร),ยังดำเนินกิจการอยู่,24/6/2558,30000000,,"กรรมการ: นายซิวกุมาร ซิงห์, นางสาววาริณี ซิงห์",16/180 ซอยเคหะคลองเตย 3 แขวงคลองเตย เขตคลองเตย กรุงเทพมหานคร 10110,ASIAN IMPORT & EXPORT COMPANY LIMITED,บริษัท เอเชี่ยน อิมปอร์ต แอนด์ เอ็กซ์ปอร์ต จำกัด,False,https://www.dataforthai.com/company/0105558103051/,ดูตำแหน่งงานจาก JOBTHAI,,,,,,,'026725583
'0105562108924,,การขายส่งอาหารเครื่องดื่มและยาสูบโดยได้รับค่าตอบแทนหรือตามสัญญาจ้าง,ยังดำเนินกิจการอยู่,21/6/2562,65000000,http://www.want-want.com/en/,"กรรมการ: นายไช่ เช่า จง, นายไช่ วั่ง เจีย, นายหลี่ ยู่ เชิง, นายเลี่ยว เหวย เซิ่น, นายอัลเบิร์ต พุทเทอรา",19 ซอยสาทร 9 แขวงยานนาวา เขตสาทร กรุงเทพมหานคร 10120,WANT WANT CORPORATION (THAILAND) LTD.,บริษัท วอนท์ วอนท์ คอร์ปอเรชั่น (ไทยแลนด์) จำกัด,False,https://www.dataforthai.com/company/0105562108924/,ดูตำแหน่งงานจาก JOBSDB,,,,,,,'0655158221
'0115564005332,,การขายส่งอาหารเครื่องดื่มและยาสูบโดยได้รับค่าตอบแทนหรือตามสัญญาจ้าง,ยังดำเนินกิจการอยู่,24/2/2564,100000000,https://ask-ginger.com/index.php/th/,"กรรมการ: นายอิทธิเชฏฐ์ เตชะไกรศรี, นายเฮจิโร่ อาซาโนะ, นายโซอิจิโร่ อาซาโนะ, นายชินยะ นานาโฮชิ",26/60 หมู่ที่ 7 ถนนกิ่งแก้ว ตำบลราชาเทวะ อำเภอบางพลี จ.สมุทรปราการ 10540,"ASANO SK GINGER CO., LTD.",บริษัท อาซาโนะ เอสเค จินเจอร์ จำกัด,False,https://www.dataforthai.com/company/0115564005332/,,,,,,,,'027384555
'0105480000011,เป็นผู้ผลิตและจำหน่ายปลีก - ส่งอาหารสด อาหารแห้ง อาหารสำเร็จรูป,กิจกรรมของบริษัทโฆษณา,ยังดำเนินกิจการอยู่,8/1/2480,122100000,,"กรรมการ: นายเฟเบียน อเล็กซานเดร เรย์ชาล, นายโทมัส ฟรองซัวส์ เดวิด ซันเชส",1168/3-4 อาคารลุมพินีทาวเวอร์ ชั้น 2 ถนนพระราม 4 แขวงทุ่งมหาเมฆ เขตสาทร กรุงเทพมหานคร 10120,THE COMMERCIAL COMPANY OF SIAM COMPANY LIMITED,บริษัท พาณิชยการแห่งประเทศไทย จำกัด,False,https://www.dataforthai.com/company/0105480000011/,,,,,,,,'022856858
'0105555034805,เป็นตัวแทน นายหน้า เพื่อจำหน่ายอาหารและเครื่องดื่ม ผ่านระบบอินเตอร์เน็ต,การขายส่งอาหารเครื่องดื่มและยาสูบโดยได้รับค่าตอบแทนหรือตามสัญญาจ้าง,ยังดำเนินกิจการอยู่,2/3/2555,204000000,,"กรรมการ: นายจอห์น ฝาง, นางสาวพิชญา ทองทั่ว, นางสาวดลิน คงเสรี",6 ชั้นที่ 11และ ชั้นที่ 12 อาคารโอ-เนส ทาวเวอร์ ซอยสุขุมวิท 6 แขวงคลองเตย เขตคลองเตย กรุงเทพมหานคร 10110,"DELIVERY HERO (THAILAND) CO., LTD.",บริษัท เดลิเวอรี่ ฮีโร่ (ประเทศไทย) จำกัด,False,https://www.dataforthai.com/company/0105555034805/,ดูตำแหน่งงานจาก JOBSDB,,,,,,,'020204900
'0315565000031,ประกอบกิจการเป็นตัวแทนจำหน่ายสินค้าประเภทเครื่องดื่ม ประเภท ไวน์ เบียร์ สุรา และเคื่องดื่ม แอลกอฮอล์ ฯลฯ,การขายส่งอาหารเครื่องดื่มและยาสูบโดยได้รับค่าตอบแทนหรือตามสัญญาจ้าง,ยังดำเนินกิจการอยู่,10/1/2565,6000000000,,กรรมการ: นายนภณ ศรีวารินทร์,609 หมู่ที่ 1 ตำบลอิสาณ อำเภอเมืองบุรีรัมย์ จ.บุรีรัมย์ 31000,"CRYPTO WINE VAULT CO., LTD.",บริษัท คริปโตไวน์วอลท์ จำกัด,False,https://www.dataforthai.com/company/0315565000031/,,,,,,,,
'0105563058769,ประกอบทีปรึกษาทางการตลาด,การขายส่งสิ่งทอเสื้อผ้ารองเท้าเครื่องหนังและของใช้ในครัวเรือนโดยได้รับค่าตอบแทนหรือตามสัญญาจ้าง,ยังดำเนินกิจการอยู่,7/4/2563,30000000,,"กรรมการ: นายอนันต์ วงศ์ทองศรี, นายปยุต วงศ์ทองซรี, นายเดชพิชัย วงศ์ทองศรี",88/145 ถนนรัชดา-รามอินทรา แขวงคันนายาว เขตคันนายาว กรุงเทพมหานคร 10230,"BBF HOLDING CO., LTD.",บริษัท บีบีเอฟ โฮลดิ้ง จำกัด,False,https://www.dataforthai.com/company/0105563058769/,,,,,,,,
'0105561020683,ประกอบกิจการนำเข้า ส่งออก และจำหน่ายส่วนประกอบหรือวัตถุดิบของเครื่องสำอางค์,การขายส่งสิ่งทอเสื้อผ้ารองเท้าเครื่องหนังและของใช้ในครัวเรือนโดยได้รับค่าตอบแทนหรือตามสัญญาจ้าง,ยังดำเนินกิจการอยู่,1/2/2561,35000000,,"กรรมการ: นายอากิฮิโระ อนดะ, นายยูโกะ ยาบิกิ, นายโกโระ ฟุรุตะ, นางสาวฮิโรมิ คันนัน",10/78 อาคารเดอะเทรนดี้ ซอยสุขุมวิท 13(แสงจันทร์) ถนนสุขุมวิท แขวงคลองเตยเหนือ เขตวัฒนา กรุงเทพมหานคร 10110,IWASE COSFA (THAILAND) COMPANY LIMITED,บริษัท อิวาเซะ คอสฟ่า (ประเทศไทย) จำกัด,False,https://www.dataforthai.com/company/0105561020683/,ดูตำแหน่งงานจาก JOBSDB,,,,,,,'026265999
'0105559089884,จำหน่ายเสื้อผ้ากีฬาแฟชั่น,การขายส่งสิ่งทอเสื้อผ้ารองเท้าเครื่องหนังและของใช้ในครัวเรือนโดยได้รับค่าตอบแทนหรือตามสัญญาจ้าง,ยังดำเนินกิจการอยู่,13/6/2559,40000000,,"กรรมการ: นายชัชวีร์ ชีวีวัฒน์, นายรวินท์ ถิระวัฒน์",19 ซอยรามคำแหง 22 (จิตตรานุเคราะห์) แขวงหัวหมาก เขตบางกะปิ กรุงเทพมหานคร,DNA SPORTS COMPANY LIMITED,บริษัท ดีเอ็นเอ สปอร์ต จำกัด,False,https://www.dataforthai.com/company/0105559089884/,,,,,,,,
'0105551029807,เป็นนายหน้าตัวแทนเครื่องสำอาง และอุปกรณ์ความงาม จำหน่ายเครื่องมือ เครื่องใช้เสริมความงาม,การขายส่งสิ่งทอเสื้อผ้ารองเท้าเครื่องหนังและของใช้ในครัวเรือนโดยได้รับค่าตอบแทนหรือตามสัญญาจ้าง,ยังดำเนินกิจการอยู่,13/3/2551,50000000,,กรรมการ: นางสาวเพชรณภารัสน์ เกตุแก้ว,131/1 หมู่ที่ 7 ตำบลนครชุม อำเภอเมืองกำแพงเพชร จ.กำแพงเพชร 62000,"PHETNAPARAS CO., LTD.",บริษัท เพชรณภารัสน์ จำกัด,False,https://www.dataforthai.com/company/0105551029807/,ดูตำแหน่งงานจาก JOBTOPGUN,,,,,,,
'0105558123761,ประกอบธุรกิจนำเข้า ส่งออกสินค้า เบรกเกอร์ โคมไฟ เครื่องสำอางค์ หลอดไฟแอลอีดี สัญญาณสวิสไฟฟ้า,การขายส่งสินค้าทั่วไป,ยังดำเนินกิจการอยู่,29/7/2558,100000000,http://www.visionnpower.com,"กรรมการ: นายชูทิน คัง, นางสาวจุง จุง ลี",1023 ถนนพัฒนาการ แขวงสวนหลวง เขตสวนหลวง กรุงเทพมหานคร 10250,VISION AND POWER COMPANY LIMITED,บริษัท วิชั่น แอนด์ พาวเวอร์ จำกัด,False,https://www.dataforthai.com/company/0105558123761/,,,,,,,,'027178114
'0105565135868,,ร้านขายปลีกสินค้าทางเภสัชภัณฑ์และเวชภัณฑ์,ยังดำเนินกิจการอยู่,22/8/2565,100000000,,"กรรมการ: นายยัน จุน, นายเหวินหลง ลู่",89 อาคารเอไอเอ แคปปิตอล เซ็นเตอร์ ห้องเลขที่ 1104 ชั้นที่ 11 ถนนรัชดาภิเษก แขวงดินแดง เขตดินแดง กรุงเทพมหานคร 10400,"SHANGHAI PHARMA (THAILAND) CO., LTD.",บริษัท เซี่ยงไฮ้ ฟาร์มา (ประเทศไทย) จำกัด,False,https://www.dataforthai.com/company/0105565135868/,ดูตำแหน่งงานจาก JOBSDB,,,,,,,'021156522
'0245563002649,นำเข้าและส่งออกเพื่อจัดจำหน่ายถุงมือยางไนไตรจากต่างประเทศ,การขายส่งสิ่งทอเสื้อผ้ารองเท้าเครื่องหนังและของใช้ในครัวเรือนโดยได้รับค่าตอบแทนหรือตามสัญญาจ้าง,ยังดำเนินกิจการอยู่,17/8/2563,100000000,,กรรมการ: นางสาวจันทิมา โบแซง,35/2 หมู่ที่ 16 ตำบลศาลาแดง อำเภอบางน้ำเปรี้ยว จ.ฉะเชิงเทรา 24000,"CHOUNGTAI INTERNATIONAL CO., LTD.",บริษัท จงไท่ อินเตอร์เนชั่นแนล จำกัด,False,https://www.dataforthai.com/company/0245563002649/,ดูตำแหน่งงานจาก JOBTHAI,,,,,,,
'0105563010332,การขายสิ่งทอ เสื้อผ้า รองเท้า เครื่องหนัง และของใช้ในครัวเรือนโดยได้รับค่าตอบแทนหรือสัญญา,การขายส่งสิ่งทอเสื้อผ้ารองเท้าเครื่องหนังและของใช้ในครัวเรือนโดยได้รับค่าตอบแทนหรือตามสัญญาจ้าง,ยังดำเนินกิจการอยู่,20/1/2563,110000000,https://www.irisohyama-thailand.com/th/,,399 อาคารอินเตอร์เชนจ 21 ห้องเลขที่ 2207-2208 ชั้นที่ 22 ถนนสุขุมวิท แขวงคลองเตยเหนือ เขตวัฒนา กรุงเทพมหานคร 10110,"IRIS OHYAMA (THAILAND) CO., LTD.",บริษัท ไอริส โอยามะ (ไทยแลนด์) จำกัด,False,https://www.dataforthai.com/company/0105563010332/,,สมาชิก dataforthai.com สามารถดูข้อมูลการติดต่อเพิ่มเติมได้  สมัครสมาชิกฟรี,,,,,,'020186102
'0115562027576,ผลิตบรรจุภัณฑ์สำหรับใส่อุปกรณ์อิเล็คทรอนิคเครื่องสำอางและอื่นๆ,การผลิตบรรจุภัณฑ์พลาสติก,ยังดำเนินกิจการอยู่,21/10/2562,300000000,,,111 หมู่ที่ 7 ตำบลบางพลีใหญ่ อำเภอบางพลี จ.สมุทรปราการ 10540,"YUTO-COSMO (THAILAND) CO., LTD.",บริษัท ยูโตะ-คอสโม (ประเทศไทย) จำกัด,False,https://www.dataforthai.com/company/0115562027576/,,สมาชิก dataforthai.com สามารถดูข้อมูลการติดต่อเพิ่มเติมได้  สมัครสมาชิกฟรี,,,,,,'021366448
'0105563037486,จำหน่ายสินค้าสำหรับบริโภค,การขายส่งสิ่งทอเสื้อผ้ารองเท้าเครื่องหนังและของใช้ในครัวเรือนโดยได้รับค่าตอบแทนหรือตามสัญญาจ้าง,ยังดำเนินกิจการอยู่,27/2/2563,400000000,,,455/75 ถนนพัฒนาการ แขวงประเวศ เขตประเวศ กรุงเทพมหานคร 10250,"SAHASAP88 CO., LTD.",บริษัท สหทรัพย์88 จำกัด,False,https://www.dataforthai.com/company/0105563037486/,,,,,,,,'0866666318
'0105561100628,การขายส่งสิ่งทอ เสื้อผ้า รองเท้า เครื่องหนัง,การขายส่งสิ่งทอเสื้อผ้ารองเท้าเครื่องหนังและของใช้ในครัวเรือนโดยได้รับค่าตอบแทนหรือตามสัญญาจ้าง,ยังดำเนินกิจการอยู่,13/6/2561,1015000000,www.footlocker.co.th,,43 อาคารไทย ซีซี ทาวเวอร์ ห้องเลขที่ A144-A148 ชั้น 14 ถนนสาทรใต้ แขวงยานนาวา เขตสาทร กรุงเทพมหานคร 10120,MAP ACTIVE ADIPERKASA COMPANY LIMITED,บริษัท แมพ แอคทีฟ อาดิเพอคาซา จำกัด,False,https://www.dataforthai.com/company/0105561100628/,ดูตำแหน่งงานจาก JOBSDB,สมาชิก dataforthai.com สามารถดูข้อมูลการติดต่อเพิ่มเติมได้  สมัครสมาชิกฟรี,,,,,,'026700184
'0105557047947,จัดจำหน่ายอุปกรณ์คอมพิวเตอร์และระบบเทคโนโลยีสารสนเทศ,การขายส่งคอมพิวเตอร์และซอฟต์แวร์อุปกรณ์อิเล็กทรอนิกส์และเครื่องมือสื่อสารโดยได้รับค่าตอบแทนหรือตามสัญญาจ้าง,ยังดำเนินกิจการอยู่,1/4/2557,30000000,,,23/81 อาคารสรชัย ชั้นที่ 20 ห้องเลขที่ A - B ซอยสุขุมวิท 63 ถนนสุขุมวิท แขวงคลองตันเหนือ เขตวัฒนา กรุงเทพมหานคร 10110,KANEMATSU ELECTRONICS (THAILAND) COMPANY LIMITED,บริษัท คาเนมัทสุ อิเล็กทรอนิกส์ (ประเทศไทย) จำกัด,False,https://www.dataforthai.com/company/0105557047947/,,สมาชิก dataforthai.com สามารถดูข้อมูลการติดต่อเพิ่มเติมได้  สมัครสมาชิกฟรี,,,,,,'026328060
'0105552130536,จำหน่ายอุปกรณ์ด้านเครื่อข่ายคอมพิวเตอร์และการสื่อสาร,การขายส่งคอมพิวเตอร์อุปกรณ์ต่อพ่วงคอมพิวเตอร์และซอฟต์แวร์,ยังดำเนินกิจการอยู่,2/12/2552,30000000,www.seanetasia.com,,51/3 อาคารวิภาวดีทาวเวอร์ ชั้นที่ 18 ถนนงามวงศ์วาน แขวงลาดยาว เขตจตุจักร กรุงเทพมหานคร 10900,"SEANET ASIA CO., LTD.",บริษัท ซีเน็ท เอเชีย จำกัด,False,https://www.dataforthai.com/company/0105552130536/,,สมาชิก dataforthai.com สามารถดูข้อมูลการติดต่อเพิ่มเติมได้  สมัครสมาชิกฟรี,,,,,,'029414033
'0105550061626,จำหน่ายและติดตั้งระบบสื่อสาร ระบบโทรศัพท์พร้อมบริการให้คำปรึกษาส่งออกจำหน่ายระบบสื่อสาร,การติดตั้งไฟฟ้า,ยังดำเนินกิจการอยู่,14/6/2550,30000000,www.nexentel.com,,20 อาคารบุปผจิต ชั้น 9 ห้องบี ถนนสาทรเหนือ แขวงสีลม เขตบางรัก กรุงเทพมหานคร 10500,NEXENTEL COMPANY LIMITED,บริษัท เน็กเซนเทล จำกัด,False,https://www.dataforthai.com/company/0105550061626/,ดูตำแหน่งงานจาก JOBTOPGUN,สมาชิก dataforthai.com สามารถดูข้อมูลการติดต่อเพิ่มเติมได้  สมัครสมาชิกฟรี,,,,,,'026522485
'0105554079295,จำหน่ายลำโพง และหูฟัง,การขายส่งเครื่องใช้ไฟฟ้าและอิเล็กทรอนิกส์ชนิดใช้ในครัวเรือน,ยังดำเนินกิจการอยู่,17/6/2554,30208200,http://www.generation-s.co.th,,410 ซอยพระยาสุเรนทร์ 30 แขวงบางชัน เขตคลองสามวา กรุงเทพมหานคร 10510,"GENERATION S CO.,LTD.",บริษัท เจนเนอเรชั่น เอส จำกัด,False,https://www.dataforthai.com/company/0105554079295/,,,,,,,,'042249466
'0105562158085,ดำเนินธุรกิจหลักในการจัดจำหน่ายอุปกรณ์คอมพิวเตอร์ สินค้าอิเล็กทรอนิกส์ อุปกรณ์ที่เกี่ยวข้อง และให้บริการสนับสนุนแก่วิสาหกิจในเครือ,การขายส่งคอมพิวเตอร์และซอฟต์แวร์อุปกรณ์อิเล็กทรอนิกส์และเครื่องมือสื่อสารโดยได้รับค่าตอบแทนหรือตามสัญญาจ้าง,ยังดำเนินกิจการอยู่,11/9/2562,31750000,,,90 อาคารซีดับเบิลยู ทาวเวอร์ อาคารบี ชั้น 22 ห้องเลขที่ บี2203 ถนนรัชดาภิเษก แขวงห้วยขวาง เขตห้วยขวาง กรุงเทพมหานคร 10310,"H3C TECHNOLOGIES (THAILAND) CO., LTD.",บริษัท เอช3ซี เทคโนโลยี่ส์ (ประเทศไทย) จำกัด,False,https://www.dataforthai.com/company/0105562158085/,,สมาชิก dataforthai.com สามารถดูข้อมูลการติดต่อเพิ่มเติมได้  สมัครสมาชิกฟรี,,,,,,'021683333
