'0105562059966,การขายส่งสินค้าเฉพาะอย่างอื่นๆ ซึ่งมิได้จัดประเภทไว้ในที่อื่นโดยได้รับค่าตอบแทนหรือตามสัญญาจ้าง,การขายส่งสินค้าเฉพาะอย่างอื่นๆซึ่งมิได้จัดประเภทไว้ในที่อื่นโดยได้รับค่าตอบแทนหรือตามสัญญาจ้าง,ยังดำเนินกิจการอยู่,28/3/2562,100000000,,"กรรมการ: นายเออิจิ คาซุยะ, นายโอซามุ โยทสึยะ",91/1 อาคารไชโย ห้องเลขที่ 705 ชั้นที่ 7 ถนนพระราม 9 แขวงห้วยขวาง เขตห้วยขวาง กรุงเทพมหานคร 10310,"NATOCO PAINT (THAILAND) CO., LTD.",บริษัท นาโตโกะ เพ้นท์ (ไทยแลนด์) จำกัด,False,https://www.dataforthai.com/company/0105562059966/,,,,,,,,'021634746
'0105554145018,ตัวแทนจัดหาซื้อสินค้า วัตถุดิบ,การขายส่งสินค้าเฉพาะอย่างอื่นๆซึ่งมิได้จัดประเภทไว้ในที่อื่นโดยได้รับค่าตอบแทนหรือตามสัญญาจ้าง,ยังดำเนินกิจการอยู่,11/11/2554,100000000,,กรรมการ: นายวรกันต์ สิทธิเสรีรัตน์,99/8 ซอยโยธินพัฒนา แขวงคลองจั่น เขตบางกะปิ กรุงเทพมหานคร 10240,"4444 TRADING CO., LTD.",บริษัท 4444 เทรดดิ้ง จำกัด,False,https://www.dataforthai.com/company/0105554145018/,ดูตำแหน่งงานจาก JOBBKK,,,,,,,
'0245560002745,การขายส่งสินค้าเฉพาะอย่างอื่นๆ ซึ่งมิได้จัดประเภทไว้ในที่อื่นโดยได้รับค่าตอบแทนหรือต,การขายส่งสินค้าเฉพาะอย่างอื่นๆซึ่งมิได้จัดประเภทไว้ในที่อื่นโดยได้รับค่าตอบแทนหรือตามสัญญาจ้าง,ยังดำเนินกิจการอยู่,28/8/2560,100000000,https://www.sprubber.co/index.php,กรรมการ: นางสาวช่อฉัตร โตชูวงศ์,9 ซอยคู้บอน 22 แขวงรามอินทรา เขตคันนายาว กรุงเทพมหานคร 10230,S.P. CONSTRUCTION RUNGRUEANG COMPANY LIMITED,บริษัท เอส.พี. ก่อสร้างรุ่งเรือง จำกัด,False,https://www.dataforthai.com/company/0245560002745/,,,,,,,,'029494598
'0105561039678,นำเข้า และส่งออก ค้าปลีก ซึ่งเคมีภัณฑ์ชนิดพิเศษ ที่ใช้ในกิจการอุตสาหกรรมต่างๆ เช่น กิจการเยื่อกระดาษ,การขายส่งสินค้าเฉพาะอย่างอื่นๆซึ่งมิได้จัดประเภทไว้ในที่อื่นโดยได้รับค่าตอบแทนหรือตามสัญญาจ้าง,ยังดำเนินกิจการอยู่,2/3/2561,103000000,,"กรรมการ: นายจอร์แดน โรเบิร์ต แบร๊คเค็ทท์, นายจี้เหวิน หลิว",33/4 อาคารเดอะ ไนน์ ทาวเวอร์ แกรนด์ พระราม 9 ชั้น 35 อาคาร A ยูนิต TNA01-04 ถนนพระราม 9 แขวงห้วยขวาง เขตห้วยขวาง กรุงเทพมหานคร 10310,SOLENIS (THAILAND) COMPANY LIMITED,บริษัท โซเลนิส (ประเทศไทย) จำกัด,False,https://www.dataforthai.com/company/0105561039678/,,,,,,,,'021180491
'0105545040951,การขายส่งสินค้าเฉพาะอย่างอื่นๆ ซึ่งมิได้จัดประเภทไว้ในที่อื่น โดยได้รับค่าตอบแทน,การขายส่งสินค้าเฉพาะอย่างอื่นๆซึ่งมิได้จัดประเภทไว้ในที่อื่นโดยได้รับค่าตอบแทนหรือตามสัญญาจ้าง,ยังดำเนินกิจการอยู่,12/4/2545,200000000,,"กรรมการ: นายวิชัย เบญจรงคกุล, นายสมชาย เบญจรงคกุล, นายปภาพรต ภู่ประเสริฐ",499 ถนนกำแพงเพชร 6 แขวงลาดยาว เขตจตุจักร กรุงเทพมหานคร 10900,UNITED DISTRIBUTION BUSINESS COMPANY LIMITED,บริษัท ยูไนเต็ด ดิสทริบิวชั่น บิซซิเนส จำกัด,False,https://www.dataforthai.com/company/0105545040951/,,,,,,,,'029532222
'0105562095458,ประกอบกิจการผลิต รับจ้างผลิต นำเข้า ส่งออก ขายส่ง ขายปลีก และจำหน่าย,การขายส่งสินค้าเฉพาะอย่างอื่นๆซึ่งมิได้จัดประเภทไว้ในที่อื่นโดยได้รับค่าตอบแทนหรือตามสัญญาจ้าง,ยังดำเนินกิจการอยู่,30/5/2562,226357300,,กรรมการ: นางสาวอินทิรา ญาณะเผือก,127 อาคารเกษร ทาวเวอร์ ชั้นที่ 21 ห้องเลขที่ B ถนนราชดำริห์ แขวงลุมพินี เขตปทุมวัน กรุงเทพมหานคร 10330,"SABIC (THAILAND) CO., LTD.",บริษัท ซาบิก (ไทยแลนด์) จำกัด,False,https://www.dataforthai.com/company/0105562095458/,,,,,,,,'020915995
'0105551092045,จำหน่ายเคมีเกษตร,การขายส่งสินค้าเฉพาะอย่างอื่นๆซึ่งมิได้จัดประเภทไว้ในที่อื่นโดยได้รับค่าตอบแทนหรือตามสัญญาจ้าง,ยังดำเนินกิจการอยู่,15/8/2551,250000000,,"กรรมการ: นายประเสริฐ แจ้งกิตติชัย, นายหยี่ชุน กู้",537/246 ซอยสาธุประดิษฐ์ 37 ถนนสาธุประดิษฐ์ แขวงช่องนนทรี เขตยานนาวา กรุงเทพมหานคร 10120,"THAI AGROTRADE CO.,LTD.",บริษัท ไทย อะโกรเทรด จำกัด,False,https://www.dataforthai.com/company/0105551092045/,,,,,,,,'022949078
'0105536006176,นายหน้าตัวแทน,การขายส่งสินค้าเฉพาะอย่างอื่นๆซึ่งมิได้จัดประเภทไว้ในที่อื่นโดยได้รับค่าตอบแทนหรือตามสัญญาจ้าง,ยังดำเนินกิจการอยู่,19/1/2536,369500000,,"กรรมการ: นางธัญญพัทธ์ ธนกิจบวรพันธุ์, นายณัฐจักร์ ธนกิจบวรพันธุ์, นางสาวภิญญดาพัชญ์ ธนกิจบวรพันธุ์, นางสาวจริยาวรรณ ธนกิจบวรพันธุ์",10/11 สุขุมวิท 33 (ซอยแดงอุดม) ถนนสุขุมวิท แขวงคลองตันเหนือ เขตวัฒนา กรุงเทพมหานคร 10110,"THANAWINN HOLDING CO., LTD.",บริษัท ธนวินท์โฮลดิ้ง จำกัด,False,https://www.dataforthai.com/company/0105536006176/,,,,,,,,
'0105536114807,บริการจัดซื้อจัดหากระดาษ วัสดุการพิมพ์,การขายส่งสินค้าเฉพาะอย่างอื่นๆซึ่งมิได้จัดประเภทไว้ในที่อื่นโดยได้รับค่าตอบแทนหรือตามสัญญาจ้าง,ยังดำเนินกิจการอยู่,7/10/2536,378000000,,"กรรมการ: นางประพีร์ ปุ้ยพันธวงศ์, พลตำรวจโทประเสริฐ เหตระกูล, นางประภา เหตระกูล ศรีนวลนัด, นางประทิน เหตระกูล, นางประพิณ รุจิรวงศ์, นายกิตติพันธุ์ เหตระกูล, นายปารเมศ เหตระกูล, นางสิริวรรณ พันธุ์ปรีชากิจ, นางสาวชนินทร เหตระกูล, นายพิสิฐ เหตระกูล, นายภาสภณ เหตระกูล",1/4 หมู่ที่ 2 ถนนวิภาวดีรังสิต แขวงตลาดบางเขน เขตหลักสี่ กรุงเทพมหานคร 10210,SAENG ENTERPRISE CORPORATION LTD.,บริษัท แสงเอ็นเตอร์ไพรส์ คอร์ปอเรชั่น จำกัด,False,https://www.dataforthai.com/company/0105536114807/,,,,,,,,'029409800
'0107554000143,การขายสินค้า,การขายส่งสินค้าเฉพาะอย่างอื่นๆซึ่งมิได้จัดประเภทไว้ในที่อื่นโดยได้รับค่าตอบแทนหรือตามสัญญาจ้าง,ยังดำเนินกิจการอยู่,20/6/2554,368793580,www.morereturn.co.th,"กรรมการ: พลตำรวจตรีลัทธสัญญา เพียรสมภาร, นายสมชาย วงศ์ทรัพย์สิน, นายฉัฐภูมิ ขันติวิริยะ, นายปรวิชย์ โอภาส, นายภัทร์บดี โฉมวงศ์, นายกวิน เฉลิมโรจน์, นางสาวกนกวรรณ บุญประกอบ, นางสาววรรณิศา ศรีสุไชย",222/148-150 อาคารชุดบ้านสวนจตุจักร ซอยวิภาวดีรังสิต 17 ถนนวิภาวดีรังสิต แขวงจตุจักร เขตจตุจักร กรุงเทพมหานคร 10900,MORE RETURN PUBLIC COMPANY LIMITED,บริษัท มอร์ รีเทิร์น จำกัด (มหาชน),False,https://www.dataforthai.com/company/0107554000143/,,,,,MORE,,,'021206804
'0115565017962,การผลิตชิ้นส่วนอากาศยาน,การผลิตอากาศยานยานอวกาศและเครื่องจักรที่เกี่ยวข้อง,ยังดำเนินกิจการอยู่,30/6/2565,30000000,,"กรรมการ: นายกรกฤช จุฬางกูร, นายตติย มีเมศกุล, นายนพพร วีรพร",789/9 โครงการทิพย์ 7 หมู่ที่ 9 ถนนเลียบคลองส่งน้ำสุวรรณภูมิ ตำบลบางปลา อำเภอบางพลี จ.สมุทรปราการ 10540,"SUMMIT LENSO CO., LTD.",บริษัท ซัมมิท เลนโซ่ จำกัด,False,https://www.dataforthai.com/company/0115565017962/,,,,,,,,'021367555
'0105561099948,,การขายส่งสินค้าทั่วไปโดยได้รับค่าตอบแทนหรือตามสัญญาจ้าง,ยังดำเนินกิจการอยู่,13/6/2561,30000000,,กรรมการ: นายไคลาช อูเดย์ พาทคี,1 อาคารเอ็มไพร์ ทาวเวอร์ ชั้นที่ 16 ยูนิต 1607-1608 ถนนสาทรใต้ แขวงยานนาวา เขตสาทร กรุงเทพมหานคร 10120,DR. REDDY'S LABORATORIES (THAILAND) COMPANY LIMITED,บริษัท ด็อกเตอร์ เรดดี้ส์ แลบบอราทอรี่ส์ (ประเทศไทย) จำกัด,False,https://www.dataforthai.com/company/0105561099948/,,,,,,,,
'0105561126252,,การขายส่งยางพาราและพลาสติกขั้นต้น,ยังดำเนินกิจการอยู่,23/7/2561,30000000,,"กรรมการ: นายจง เฟย เหยิน, นางสาวปัณชญา เหล่าบัณฑิต",163 หมู่ที่ 7 ตำบลวัดธาตุ อำเภอเมืองหนองคาย จ.หนองคาย 43000,"TC LUMBER CO., LTD.",บริษัท ทีซี ลัมเบอร์ จำกัด,False,https://www.dataforthai.com/company/0105561126252/,,,,,,,,'0269410656
'0105565040557,นายหน้า ตัวแทน,การขายส่งสินค้าทั่วไปโดยได้รับค่าตอบแทนหรือตามสัญญาจ้าง,ยังดำเนินกิจการอยู่,3/3/2565,30000000,https://www.ttbconsumer.com/,"กรรมการ: นางณัฐวรรณ อภิรัตนพิมลชัย, นายจเร เจียรธนะกานนท์, นางประภาศิริ โฆษิตธนากร, นางสาวปรีดิอร คลังนาค",3000 ตึกธนาคารทหารไทยธนชาต ชั้นที่ 17 ถนนพหลโยธิน แขวงจอมพล เขตจตุจักร กรุงเทพมหานคร 10900,TTB CONSUMER COMPANY LIMITED,บริษัท ทีทีบี คอนซูมเมอร์ จำกัด,False,https://www.dataforthai.com/company/0105565040557/,,,,,,,,'022423142
'0125542001652,,การขายส่งสินค้าทั่วไปโดยได้รับค่าตอบแทนหรือตามสัญญาจ้าง,ยังดำเนินกิจการอยู่,18/3/2542,30000000,,กรรมการ: นายปราโมทย์ คงประเสริฐ,4 ถนนพระราม 9 แขวงหัวหมาก เขตบางกะปิ กรุงเทพมหานคร,"NARIS ENTERPRISE CO., LTD.",บริษัท นริศ เอ็นเตอร์ไพรส์ จำกัด,False,https://www.dataforthai.com/company/0125542001652/,,,,,,,,'025554992
'0835549000469,ีรับบริหารดูแลสถานที่ตากอากาศ โรงแรม อาคารชุด,การขายส่งสินค้าทั่วไปโดยได้รับค่าตอบแทนหรือตามสัญญาจ้าง,ยังดำเนินกิจการอยู่,10/1/2549,30000000,http://www.brownstarling.com/,"กรรมการ: นายกิตติพงศ์ สุนทรรังสรรค์, นายวีระชัย ปรานวีระไพบูลย์, นางสาวชวรีย์ ชะวะนะเวช, นางกนกพรรณ ปรานวีระไพบูลย์",136/275-276 หมู่ที่ 4 ซอยแซทเทอร์เดย์ ถนนใสยวน-กะตะ ตำบลราไวย์ อำเภอเมืองภูเก็ต จ.ภูเก็ต 83130,BROWN STARLING COMPANY LIMITED,บริษัท บราวน์ สตาร์ลิ่ง จำกัด,False,https://www.dataforthai.com/company/0835549000469/,ดูตำแหน่งงานจาก JOBTOPGUN,,,,,,,'076613081
'0105546100876,"นายหน้า,ตัวแทน,ตัวแทนค้าต่างในกิจการขายทุกประเภท",การขายส่งสินค้าทั่วไปโดยได้รับค่าตอบแทนหรือตามสัญญาจ้าง,ยังดำเนินกิจการอยู่,25/8/2546,30000000,,กรรมการ: นายศักดิ์ศิษฏ์ ดุลย์โกวิท,99/4 ซอยลาดพร้าว 8 ถนนลาดพร้าว แขวงจอมพล เขตจตุจักร กรุงเทพมหานคร 10900,YSA GLOBAL COMPANY LIMITED,บริษัท วาย เอส เอ โกลบอล จำกัด,False,https://www.dataforthai.com/company/0105546100876/,,,,,,,,'029386800
'0105562012021,,การขายส่งสินค้าทั่วไปโดยได้รับค่าตอบแทนหรือตามสัญญาจ้าง,ยังดำเนินกิจการอยู่,21/1/2562,80000000,,"กรรมการ: นางสาววรัชยา เทวาดิเทพ, นางพิมพร เซียวล่ำซำ",88 หมู่ที่ 1 ตำบลโคกขาม อำเภอเมืองสมุทรสาคร จ.สมุทรสาคร 74000,FIRST GROUP (THAILAND) COMPANY LIMITED,บริษัท เฟิร์ส กรุ๊ป (ประเทศไทย) จำกัด,False,https://www.dataforthai.com/company/0105562012021/,,,,,,,,
'0745549000737,ขายและบริการ,การขายส่งเครื่องจักรและอุปกรณ์อื่นๆซึ่งมิได้จัดประเภทไว้ในที่อื่น,ยังดำเนินกิจการอยู่,14/2/2549,30000000,,กรรมการ: นางสาวกรรณิกา ชินธรรมมิตร์,219/27 หมู่ที่ 12 ถนนเพชรเกษม ตำบลอ้อมน้อย อำเภอกระทุ่มแบน จ.สมุทรสาคร 74130,AXIOMATIC COMPANY LIMITED,บริษัท แอคซิโอเมติค จำกัด,False,https://www.dataforthai.com/company/0745549000737/,,,,,,,,'024632900
'0105561088504,,การขายส่งสินค้าทั่วไปโดยได้รับค่าตอบแทนหรือตามสัญญาจ้าง,ยังดำเนินกิจการอยู่,24/5/2561,30000000,,กรรมการ: นายทนงชัย แซ่อู้,202 อาคารเลอ คองคอร์ด ชั้นที่ 21 ถนนรัชดาภิเษก แขวงห้วยขวาง เขตห้วยขวาง กรุงเทพมหานคร 10310,ANNIER MEDICAL MANAGEMENT (THAILAND) COMPANY LIMITED,บริษัท แอนนิเออร์ การจัดการทางการแพทย์ (ประเทศไทย) จำกัด,False,https://www.dataforthai.com/company/0105561088504/,,,,,,,,
'0105560202117,การขายส่งสินค้าทั่งไปโดยได้รับค่าตอบแทนหรือตามสัญญาจ้าง สารเคมี เคมีภัณฑ์,การขายส่งสินค้าทั่วไปโดยได้รับค่าตอบแทนหรือตามสัญญาจ้าง,ยังดำเนินกิจการอยู่,1/12/2560,30000000,,"กรรมการ: นายมาโกโตะ ยามาดะ, นายเรียวจิ โคนิชิ, นายชุนสุเกะ ฮิราโน่, นายโนโบรุ โมโรกุจิ",163 อาคารไทยสมุทร ห้องเลขที่ 17บี ชั้นที่ 17 ถนนสุรวงศ์ แขวงสุริยวงศ์ เขตบางรัก กรุงเทพมหานคร 10500,KONISHIYASU TRADING (THAILAND) COMPANY LIMITED,บริษัท โคนิชิยาสึ เทรดดิ้ง (ประเทศไทย) จำกัด,False,https://www.dataforthai.com/company/0105560202117/,,,,,,,,'022342526
'0105561094628,ขายส่งสินค้าทั่วไป,การขายส่งสินค้าทั่วไปโดยได้รับค่าตอบแทนหรือตามสัญญาจ้าง,ยังดำเนินกิจการอยู่,4/6/2561,30000000,,กรรมการ: นางเบญจพร วงศ์หงษ์กุล,1104/6 ถนนพัฒนาการ แขวงสวนหลวง เขตสวนหลวง กรุงเทพมหานคร 10250,"DYMAXTION CORPORATION 88 CO., LTD.",บริษัท ไดแม๊กซ์ชั่น คอร์ปอเรชั่น 88 จำกัด,False,https://www.dataforthai.com/company/0105561094628/,,,,,,,,
'0105563140147,,การขายส่งสินค้าทั่วไปโดยได้รับค่าตอบแทนหรือตามสัญญาจ้าง,ยังดำเนินกิจการอยู่,23/9/2563,32000000,,กรรมการ: นายหลง เย่,686/1 หมู่บ้าน เปี่ยมสุข ซอยพัฒนาการ 44 แขวงสวนหลวง เขตสวนหลวง กรุงเทพมหานคร 10250,"LOFIS INTERNATIONAL TRADE CO., LTD.",บริษัท โลฟิส อินเตอร์เนชั่นแนล เทรด จำกัด,False,https://www.dataforthai.com/company/0105563140147/,,,,,,,,
'0105561098020,การขายส่ง และขายปลีก สินค้าทั่วไป,การขายส่งสินค้าทั่วไปโดยได้รับค่าตอบแทนหรือตามสัญญาจ้าง,ยังดำเนินกิจการอยู่,8/6/2561,33000000,https://anewday.co.th/,"กรรมการ: นายราชันย์ อารยะวงศ์ชัย, นางสาวลดาวรรณ เองเลิศชะพัศ, นางสาวสาริศา คชเสนี",634/4 ซอยรามคำแหง 39 (เทพลีลา1) ถนนประชาอุทิศ แขวงวังทองหลาง เขตวังทองหลาง กรุงเทพมหานคร 10310,A NEW DAY COMPANY LIMITED,บริษัท อะนิวเดย์ จำกัด,False,https://www.dataforthai.com/company/0105561098020/,,,,,,,,'027250888
'0105552117921,การขายส่งสินค้าทั่วไป,การขายส่งสินค้าทั่วไปโดยได้รับค่าตอบแทนหรือตามสัญญาจ้าง,ยังดำเนินกิจการอยู่,30/10/2552,35000000,http://www.syneg.com,"กรรมการ: นายลู จอง ชิง, นายอนุชา โชติรสเวคิน, นายสรากร กุลธรรม, นายพิสิฐ อัครพัฒนากูล, นางสาวศุพิสา จักษุดุลย์",2/38 ซอยบางนา-ตราด 25 แขวงบางนาเหนือ เขตบางนา กรุงเทพมหานคร 10260,MERCURIA RESOURCES COMPANY LIMITED,บริษัท ซินเนอร์จี้ เอนเนอร์จี้ (ไทยแลนด์) จำกัด,False,https://www.dataforthai.com/company/0105552117921/,ดูตำแหน่งงานจาก JOBTOPGUN,,,,,,,
